{
  "profileVersion": "thought-khoral.agent-conversation.v1",
  "requestId": "11111111-1111-4111-8111-111111111111",
  "roomId": "22222222-2222-4222-8222-222222222222",
  "agentId": "74686f75-6768-746b-686f-72616c000004",
  "occurredAt": "2026-10-02T16:00:00Z",
  "text": "@codex-agent What did Maya propose?",
  "mentions": [
    {
      "type": "participant",
      "id": "74686f75-6768-746b-686f-72616c000004",
      "token": "codex-agent"
    }
  ],
  "conversation": {
    "mode": "new"
  }
}
